{
  "schema_version": 1,
  "updated_on": "2026-07-15T22:44:00Z",
  "status": "completed",
  "current_phase": "P34",
  "next_authorized_phase": "P34",
  "phase_queue": [
    "P06",
    "P07",
    "P08",
    "P09",
    "P10",
    "P11",
    "P12",
    "P13",
    "P14",
    "P15",
    "P16",
    "P17",
    "P18",
    "P19",
    "P20",
    "P21",
    "P22",
    "P23",
    "P24",
    "P25",
    "P26",
    "P27",
    "P28",
    "P29",
    "P30",
    "P31",
    "P32",
    "P33",
    "P34"
  ],
  "phase_states": [
    {
      "id": "P06",
      "status": "completed",
      "updated_on": "2026-07-15T22:44:00Z",
      "evidence": [
        "safety-checkpoint:32bd53579500a327a67ad39feda077cf6c9285df",
        "merge:7ad5599458ba05aa8bfcf506912d15c16c9f2e70",
        "post-merge-verification:full-tests-passed"
      ]
    },
    {
      "id": "P34",
      "status": "completed",
      "updated_on": "2026-07-15T22:44:00Z",
      "evidence": [
        "phase-tracker:P06-P34-closure-recorded"
      ]
    }
  ],
  "last_checkpoint": {
    "phase": "P06",
    "path": "docs/owner-control/orchestrator/checkpoints/p06-post-merge-closure.checkpoint.json",
    "sha256": "bc0fc7eda7d2d83105de3c1b105034255f7513fdf911fbdf8fb143dede46e04c",
    "created_on": "2026-07-15T22:44:00Z"
  },
  "emergency_stop": {
    "active": false,
    "reason": ""
  },
  "integrity": {
    "sha256_manifest": true,
    "last_verified_sha256": "bc0fc7eda7d2d83105de3c1b105034255f7513fdf911fbdf8fb143dede46e04c"
  }
}
